{
  "schema": "uzpainter/parity/golden-public/1",
  "record_class": "public_manifest",
  "golden_id": "tier0/semantics/export-padding-ramp-r2-p75",
  "tier": "0",
  "domain": "tier0/export/processing",
  "description": "P-ramp of decision 129 (phase1.25_pilot-wand item 2.7: the ring across a UV seam), exploratory: the seam mesh of scale ratio 2, +0.75/1024, its OBJ the text decision 129 fixes by SHA-256; document resolution 1024. User0 added as RGB32F (the template capture of both recordings records its stored format; a record where it is not 32F is void); one fill with only User0 active, source the authored float32 UV ramp R = (x + 0.5)/N, G = (y + 0.5)/N, B = 0.5 at the document size, default projection (read back), Normal at opacity 1. User0 at OpenEXR 32f with infinite padding and with passthrough (every covered texel must equal the ramp bit for bit, or the probe is void), every export step done twice in the session.",
  "inputs": [
    {
      "input_id": "seam-ramp-r2-p75",
      "kind": "mesh",
      "path": "parity/fixtures/tier0-semantics/meshes/seam-ramp-r2-p75.obj",
      "sha256": "b8b4a1ab1574c874d33db00128c0d33d9405afc222c067e22b080a540ea69d87",
      "provenance": {
        "origin": "uzmigames_authored",
        "licence": "Apache-2.0",
        "note": "Generated by tools/parity/tier0_semantics/request_fixtures.py."
      }
    },
    {
      "input_id": "uv-ramp-1024",
      "kind": "image",
      "path": "parity/fixtures/tier0-semantics/bitmaps/uv-ramp-1024.exr",
      "sha256": "1ba4fce972e120b0062b056e51f64debb23b9de5571b5ff210dbe4b82becfb81",
      "provenance": {
        "origin": "uzmigames_authored",
        "licence": "Apache-2.0",
        "note": "Generated by tools/parity/tier0_semantics/request_fixtures.py."
      }
    }
  ],
  "instruction_sequence": {
    "author": "UzmiGames",
    "interface": "substance_painter_documented_python_api",
    "steps": [
      {
        "step": 1,
        "call": "substance_painter.project.create",
        "args": {
          "mesh": "seam-ramp-r2-p75",
          "normal_map_format": "OpenGL",
          "default_texture_resolution": 1024
        }
      },
      {
        "step": 2,
        "call": "substance_painter.textureset.Stack.add_channel",
        "args": {
          "channel": "User0",
          "format": "RGB32F"
        }
      },
      {
        "step": 3,
        "call": "substance_painter.resource.import_project_resource",
        "args": {
          "input": "uv-ramp-1024",
          "usage": "TEXTURE"
        }
      },
      {
        "step": 4,
        "call": "substance_painter.layerstack.insert_fill",
        "args": {
          "position": "top",
          "texture_set": "uzp_seam"
        }
      },
      {
        "step": 5,
        "call": "substance_painter.layerstack.FillLayerNode.active_channels",
        "args": {
          "node_step": 4,
          "channels": [
            "User0"
          ]
        }
      },
      {
        "step": 6,
        "call": "substance_painter.layerstack.FillLayerNode.set_source",
        "args": {
          "node_step": 4,
          "channel": "User0",
          "resource_step": 3
        }
      },
      {
        "step": 7,
        "call": "substance_painter.layerstack.Node.set_blending_mode",
        "args": {
          "node_step": 4,
          "blending_mode": "Normal",
          "channel": "User0"
        }
      },
      {
        "step": 8,
        "call": "substance_painter.layerstack.Node.set_opacity",
        "args": {
          "node_step": 4,
          "opacity": 1.0,
          "channel": "User0"
        }
      },
      {
        "step": 9,
        "call": "substance_painter.layerstack.FillLayerNode.get_projection_parameters",
        "args": {
          "node_step": 4
        }
      },
      {
        "step": 10,
        "call": "substance_painter.export.export_project_textures",
        "args": {
          "maps": [
            "documentMap/user0:RGB"
          ],
          "file_format": "exr",
          "bit_depth": "32f",
          "padding": "infinite",
          "dithering": false
        }
      },
      {
        "step": 11,
        "call": "substance_painter.export.export_project_textures",
        "args": {
          "maps": [
            "documentMap/user0:RGB"
          ],
          "file_format": "exr",
          "bit_depth": "32f",
          "padding": "infinite",
          "dithering": false
        }
      },
      {
        "step": 12,
        "call": "substance_painter.export.export_project_textures",
        "args": {
          "maps": [
            "documentMap/user0:RGB"
          ],
          "file_format": "exr",
          "bit_depth": "32f",
          "padding": "passthrough",
          "dithering": false
        }
      },
      {
        "step": 13,
        "call": "substance_painter.export.export_project_textures",
        "args": {
          "maps": [
            "documentMap/user0:RGB"
          ],
          "file_format": "exr",
          "bit_depth": "32f",
          "padding": "passthrough",
          "dithering": false
        }
      }
    ]
  },
  "applied_settings": [
    {
      "name": "project.normal_map_format",
      "value": "OpenGL",
      "applied_by": "recorder_api"
    },
    {
      "name": "texture_set.resolution",
      "value": 1024,
      "unit": "px",
      "applied_by": "recorder_api"
    },
    {
      "name": "export.exr.bit_depth",
      "value": "32f",
      "applied_by": "recorder_api"
    },
    {
      "name": "export.padding",
      "value": "infinite",
      "applied_by": "recorder_api"
    },
    {
      "name": "export.dithering",
      "value": false,
      "applied_by": "recorder_api"
    },
    {
      "name": "export.padding",
      "value": "passthrough",
      "applied_by": "recorder_api"
    }
  ],
  "expectations": [],
  "software": {
    "painter": {
      "product": "Adobe Substance 3D Painter",
      "version": "12.2.0",
      "build_id": "12.2.0+js-api.1.1.20"
    },
    "uzpainter_build_hash": null
  },
  "private_records": [
    {
      "record_id": "golden-record",
      "kind": "private_oracle_record",
      "sha256": "5391764808551712d5dc8dbf6d87b25e17bc4e13a89b392531aca4615179db42",
      "size_bytes": 10535
    },
    {
      "record_id": "r1-uzp_seam-user0-step10",
      "kind": "exported_map",
      "sha256": "2e801f9a5a008e5deb3d7aeec25d2b0e7516cbc36d93734615ee76011065e60b",
      "size_bytes": 39609
    },
    {
      "record_id": "r1-uzp_seam-user0-step11",
      "kind": "exported_map",
      "sha256": "2e801f9a5a008e5deb3d7aeec25d2b0e7516cbc36d93734615ee76011065e60b",
      "size_bytes": 39609
    },
    {
      "record_id": "r1-uzp_seam-user0-step12",
      "kind": "exported_map",
      "sha256": "2e801f9a5a008e5deb3d7aeec25d2b0e7516cbc36d93734615ee76011065e60b",
      "size_bytes": 39609
    },
    {
      "record_id": "r1-uzp_seam-user0-step13",
      "kind": "exported_map",
      "sha256": "2e801f9a5a008e5deb3d7aeec25d2b0e7516cbc36d93734615ee76011065e60b",
      "size_bytes": 39609
    },
    {
      "record_id": "r2-uzp_seam-user0-step10",
      "kind": "exported_map",
      "sha256": "2e801f9a5a008e5deb3d7aeec25d2b0e7516cbc36d93734615ee76011065e60b",
      "size_bytes": 39609
    },
    {
      "record_id": "r2-uzp_seam-user0-step11",
      "kind": "exported_map",
      "sha256": "2e801f9a5a008e5deb3d7aeec25d2b0e7516cbc36d93734615ee76011065e60b",
      "size_bytes": 39609
    },
    {
      "record_id": "r2-uzp_seam-user0-step12",
      "kind": "exported_map",
      "sha256": "2e801f9a5a008e5deb3d7aeec25d2b0e7516cbc36d93734615ee76011065e60b",
      "size_bytes": 39609
    },
    {
      "record_id": "r2-uzp_seam-user0-step13",
      "kind": "exported_map",
      "sha256": "2e801f9a5a008e5deb3d7aeec25d2b0e7516cbc36d93734615ee76011065e60b",
      "size_bytes": 39609
    },
    {
      "record_id": "oracle-environment",
      "kind": "oracle_environment_record",
      "sha256": "332ddce6024e25f9b84ec9ce03850aa0c52809a6ba64a43283ef0ef7cf1edd4b",
      "size_bytes": 402
    }
  ]
}
