{
  "schema": "uzpainter/parity/golden-public/1",
  "record_class": "public_manifest",
  "golden_id": "tier0/api-probes/phase1-texture-throttling",
  "tier": "0",
  "domain": "tier0/api-probes/phase1-texture-throttling",
  "description": "API probe P21-C (decision 110): TextureStateEvent.cache_key_invalidation_throttling_period() on the plane, recorded first in a fresh Painter session (no script has set it), in the first session and after save/reopen.",
  "inputs": [
    {
      "input_id": "plane",
      "kind": "mesh",
      "path": "parity/fixtures/meshes/plane.obj",
      "sha256": "7d3c5f616c2abf4b06050434fa943d19dcb15ec998245a211d1d4ca7e95197fe",
      "provenance": {
        "origin": "uzmigames_authored",
        "licence": "Apache-2.0"
      }
    }
  ],
  "instruction_sequence": {
    "author": "UzmiGames",
    "interface": "substance_painter_documented_python_api",
    "steps": [
      {
        "step": 1,
        "call": "substance_painter.project.create",
        "args": {
          "mesh": "plane",
          "normal_map_format": "OpenGL",
          "default_texture_resolution": 256
        }
      },
      {
        "step": 2,
        "call": "substance_painter.event.Dispatcher.connect",
        "args": {
          "events": [
            "BusyStatusChanged"
          ]
        }
      },
      {
        "step": 3,
        "call": "substance_painter.event.TextureStateEvent.cache_key_invalidation_throttling_period",
        "args": {}
      }
    ]
  },
  "applied_settings": [
    {
      "name": "project.normal_map_format",
      "value": "OpenGL",
      "applied_by": "recorder_api"
    },
    {
      "name": "texture_set.resolution",
      "value": 256,
      "unit": "px",
      "applied_by": "recorder_api"
    }
  ],
  "expectations": [],
  "software": {
    "painter": {
      "product": "Adobe Substance 3D Painter",
      "version": "12.1.5",
      "build_id": "12.1.5+js-api.1.1.20"
    },
    "uzpainter_build_hash": null
  },
  "private_records": [
    {
      "record_id": "golden-record",
      "kind": "private_oracle_record",
      "sha256": "37e499ad4702f3e0b7a0045c3fcd5f22c2baf4cd2edc28218803b09db5feef87",
      "size_bytes": 5533
    },
    {
      "record_id": "oracle-environment",
      "kind": "oracle_environment_record",
      "sha256": "e7ba66f8da440f296396951152832b595f05b4d187e5ea98eeff3c8f44cf906c",
      "size_bytes": 402
    }
  ]
}
