{
  "schema": "uzpainter/parity/golden-public/1",
  "record_class": "public_manifest",
  "golden_id": "tier0/api-probes/phase1-default-camera-plane",
  "tier": "0",
  "domain": "tier0/api-probes/phase1-default-camera-plane",
  "description": "Recording R-132-A (decision 132): Painter's default camera after project.create on the plane fixture mesh, all eight documented properties read through Camera.get_default_camera(), with the scene bounding box, in the first session and after save/reopen.",
  "inputs": [
    {
      "input_id": "plane",
      "kind": "mesh",
      "path": "parity/fixtures/meshes/plane.obj",
      "sha256": "7d3c5f616c2abf4b06050434fa943d19dcb15ec998245a211d1d4ca7e95197fe",
      "provenance": {
        "origin": "uzmigames_authored",
        "licence": "Apache-2.0"
      }
    }
  ],
  "instruction_sequence": {
    "author": "UzmiGames",
    "interface": "substance_painter_documented_python_api",
    "steps": [
      {
        "step": 1,
        "call": "substance_painter.project.create",
        "args": {
          "mesh": "plane",
          "normal_map_format": "OpenGL",
          "default_texture_resolution": 256
        }
      },
      {
        "step": 2,
        "call": "substance_painter.event.Dispatcher.connect",
        "args": {
          "events": [
            "BusyStatusChanged"
          ]
        }
      },
      {
        "step": 3,
        "call": "substance_painter.display.Camera.get_default_camera",
        "args": {}
      },
      {
        "step": 4,
        "call": "substance_painter.project.get_scene_bounding_box",
        "args": {}
      }
    ]
  },
  "applied_settings": [
    {
      "name": "project.normal_map_format",
      "value": "OpenGL",
      "applied_by": "recorder_api"
    },
    {
      "name": "texture_set.resolution",
      "value": 256,
      "unit": "px",
      "applied_by": "recorder_api"
    }
  ],
  "expectations": [],
  "software": {
    "painter": {
      "product": "Adobe Substance 3D Painter",
      "version": "12.1.5",
      "build_id": "12.1.5+js-api.1.1.20"
    },
    "uzpainter_build_hash": null
  },
  "private_records": [
    {
      "record_id": "golden-record",
      "kind": "private_oracle_record",
      "sha256": "abc545251e7cfaaa64a03e989fec8a3479fcac092521252fc1df752195a4f4ea",
      "size_bytes": 6933
    },
    {
      "record_id": "oracle-environment",
      "kind": "oracle_environment_record",
      "sha256": "5b3a03531a5044fc65b10e6b62a59c26b6b2f518af05b2e508725f2df2979b88",
      "size_bytes": 402
    }
  ]
}
