{
  "schema": "uzpainter/parity/golden-public/1",
  "record_class": "public_manifest",
  "golden_id": "tier0/semantics/export-template-base-maxwell-specular-glossiness",
  "tier": "0",
  "domain": "tier0/stack/base-values",
  "description": "The linear value of an empty sRGB8 base (phase1.25_pilot-wand item 2.6, decision 126): an empty project on the authored plane created with the shipped template templates/Maxwell - Specular Glossiness.spt; BaseColor and Specular (Painter skips a map the template lacks) at OpenEXR 32f, and at PNG 16 as the control against the recorded base-values code; infinite padding, no dithering, every export step done twice in the session.",
  "inputs": [
    {
      "input_id": "plane",
      "kind": "mesh",
      "path": "parity/fixtures/meshes/plane.obj",
      "sha256": "7d3c5f616c2abf4b06050434fa943d19dcb15ec998245a211d1d4ca7e95197fe",
      "provenance": {
        "origin": "uzmigames_authored",
        "licence": "Apache-2.0"
      }
    }
  ],
  "instruction_sequence": {
    "author": "UzmiGames",
    "interface": "substance_painter_documented_python_api",
    "steps": [
      {
        "step": 1,
        "call": "substance_painter.project.create",
        "args": {
          "mesh": "plane",
          "normal_map_format": "OpenGL",
          "default_texture_resolution": 256,
          "template": "templates/Maxwell - Specular Glossiness.spt"
        }
      },
      {
        "step": 2,
        "call": "substance_painter.export.export_project_textures",
        "args": {
          "maps": [
            "documentMap/basecolor:RGB",
            "documentMap/specular:RGB"
          ],
          "file_format": "exr",
          "bit_depth": "32f",
          "padding": "infinite",
          "dithering": false
        }
      },
      {
        "step": 3,
        "call": "substance_painter.export.export_project_textures",
        "args": {
          "maps": [
            "documentMap/basecolor:RGB",
            "documentMap/specular:RGB"
          ],
          "file_format": "exr",
          "bit_depth": "32f",
          "padding": "infinite",
          "dithering": false
        }
      },
      {
        "step": 4,
        "call": "substance_painter.export.export_project_textures",
        "args": {
          "maps": [
            "documentMap/basecolor:RGB",
            "documentMap/specular:RGB"
          ],
          "file_format": "png",
          "bit_depth": 16,
          "padding": "infinite",
          "dithering": false
        }
      },
      {
        "step": 5,
        "call": "substance_painter.export.export_project_textures",
        "args": {
          "maps": [
            "documentMap/basecolor:RGB",
            "documentMap/specular:RGB"
          ],
          "file_format": "png",
          "bit_depth": 16,
          "padding": "infinite",
          "dithering": false
        }
      }
    ]
  },
  "applied_settings": [
    {
      "name": "project.normal_map_format",
      "value": "OpenGL",
      "applied_by": "recorder_api"
    },
    {
      "name": "texture_set.resolution",
      "value": 256,
      "unit": "px",
      "applied_by": "recorder_api"
    },
    {
      "name": "project.template",
      "value": "templates/Maxwell - Specular Glossiness.spt",
      "applied_by": "recorder_api"
    },
    {
      "name": "export.exr.bit_depth",
      "value": "32f",
      "applied_by": "recorder_api"
    },
    {
      "name": "export.padding",
      "value": "infinite",
      "applied_by": "recorder_api"
    },
    {
      "name": "export.dithering",
      "value": false,
      "applied_by": "recorder_api"
    },
    {
      "name": "export.png.bit_depth",
      "value": 16,
      "applied_by": "recorder_api"
    }
  ],
  "expectations": [],
  "software": {
    "painter": {
      "product": "Adobe Substance 3D Painter",
      "version": "12.2.0",
      "build_id": "12.2.0+js-api.1.1.20"
    },
    "uzpainter_build_hash": null
  },
  "private_records": [
    {
      "record_id": "golden-record",
      "kind": "private_oracle_record",
      "sha256": "c77535d706132a6c83a734fc79eda77ad7b66b895f32076b53245da4b64da82c",
      "size_bytes": 7835
    },
    {
      "record_id": "r1-uzp_plane-specular-step2",
      "kind": "exported_map",
      "sha256": "2de2c6c8567ff9c0591c53583b8ba72fd7dd3783c6dba445d4a6e7dac4e28e66",
      "size_bytes": 28809
    },
    {
      "record_id": "r1-uzp_plane-specular-step3",
      "kind": "exported_map",
      "sha256": "2de2c6c8567ff9c0591c53583b8ba72fd7dd3783c6dba445d4a6e7dac4e28e66",
      "size_bytes": 28809
    },
    {
      "record_id": "r1-uzp_plane-specular-step4",
      "kind": "exported_map",
      "sha256": "2dd3ecd750ba17295738a84680dea5f29ddb5ef0fb56bb73ddd1e73b840124ce",
      "size_bytes": 1009
    },
    {
      "record_id": "r1-uzp_plane-specular-step5",
      "kind": "exported_map",
      "sha256": "2dd3ecd750ba17295738a84680dea5f29ddb5ef0fb56bb73ddd1e73b840124ce",
      "size_bytes": 1009
    },
    {
      "record_id": "r2-uzp_plane-specular-step2",
      "kind": "exported_map",
      "sha256": "2de2c6c8567ff9c0591c53583b8ba72fd7dd3783c6dba445d4a6e7dac4e28e66",
      "size_bytes": 28809
    },
    {
      "record_id": "r2-uzp_plane-specular-step3",
      "kind": "exported_map",
      "sha256": "2de2c6c8567ff9c0591c53583b8ba72fd7dd3783c6dba445d4a6e7dac4e28e66",
      "size_bytes": 28809
    },
    {
      "record_id": "r2-uzp_plane-specular-step4",
      "kind": "exported_map",
      "sha256": "2dd3ecd750ba17295738a84680dea5f29ddb5ef0fb56bb73ddd1e73b840124ce",
      "size_bytes": 1009
    },
    {
      "record_id": "r2-uzp_plane-specular-step5",
      "kind": "exported_map",
      "sha256": "2dd3ecd750ba17295738a84680dea5f29ddb5ef0fb56bb73ddd1e73b840124ce",
      "size_bytes": 1009
    },
    {
      "record_id": "oracle-environment",
      "kind": "oracle_environment_record",
      "sha256": "332ddce6024e25f9b84ec9ce03850aa0c52809a6ba64a43283ef0ef7cf1edd4b",
      "size_bytes": 402
    }
  ]
}
